"country","date","name","actual","consensus","previous","volatility"
"European Monetary Union","20121217 09:00:00","Labour cost","","","1.600  %","2"
"Canada","20121217 13:30:00","Canadian portfolio investment in foreign securities","","","$ 6.030 ","1"
"Canada","20121217 13:30:00","Foreign portfolio investment in Canadian securities","","","$ 13.920 ","1"
"United States","20121217 13:30:00","NY Empire State Manufacturing Index",""," -0.500 "," -5.220 ","1"
"United States","20121217 14:00:00","Net Long-Term TIC Flows","","","$ 3.300 ","2"
"United States","20121217 14:00:00","Total Net TIC Flows","","","$ 4.700 ","1"
"Peru","20121217 15:00:00","Gross Domestic Product","","","1.100  %","1"
"United States","20121217 18:00:00","Fed's Lacker speech","","","","1"
"Australia","20121217 23:00:00","Conference Board Australia Leading Index","","","-0.300  %","2"
